{
  "paymentId": "11111111-1111-4111-8111-111111111111",
  "internalEndToEndId": "E12345678202606261234abcdefghijk",
  "externalEndToEndId": null,
  "status": "UNKNOWN",
  "amount": {
    "currency": "BRL",
    "amountCents": "12345"
  },
  "createdAt": "2026-06-26T12:00:00Z",
  "correlationId": "22222222-2222-4222-8222-222222222222"
}
